{
  "$schema": "https://json-schema.org/draft/2020-12/schema",
  "$id": "https://github.com/GarrettAudet/SWECircuit/schemas/v1alpha1/specialist-handoff.schema.json",
  "title": "SWECircuit Specialist Agent Handoff v1alpha1",
  "description": "Closed provider-neutral result envelope for one compiled specialist agent.",
  "type": "object",
  "additionalProperties": false,
  "required": [
    "apiVersion",
    "kind",
    "outcome",
    "destination",
    "goal",
    "agent",
    "compilationDigest",
    "summary",
    "workUnitsCompleted",
    "artifacts",
    "evidence",
    "assumptions",
    "risks",
    "followUps"
  ],
  "properties": {
    "apiVersion": {
      "const": "swecircuit/specialist/v1alpha1"
    },
    "kind": {
      "const": "SpecialistAgentHandoff"
    },
    "outcome": {
      "$ref": "#/$defs/outcome"
    },
    "destination": {
      "$ref": "#/$defs/text"
    },
    "goal": {
      "type": "object",
      "additionalProperties": false,
      "required": ["id", "revision", "digest"],
      "properties": {
        "id": {
          "$ref": "#/$defs/identifier"
        },
        "revision": {
          "type": "integer",
          "minimum": 1
        },
        "digest": {
          "$ref": "#/$defs/digest"
        }
      }
    },
    "agent": {
      "type": "object",
      "additionalProperties": false,
      "required": ["id", "blueprintDigest"],
      "properties": {
        "id": {
          "$ref": "#/$defs/identifier"
        },
        "blueprintDigest": {
          "$ref": "#/$defs/digest"
        }
      }
    },
    "compilationDigest": {
      "$ref": "#/$defs/digest"
    },
    "summary": {
      "$ref": "#/$defs/text"
    },
    "workUnitsCompleted": {
      "type": "array",
      "maxItems": 64,
      "uniqueItems": true,
      "items": {
        "$ref": "#/$defs/identifier"
      }
    },
    "artifacts": {
      "type": "array",
      "maxItems": 128,
      "items": {
        "$ref": "#/$defs/artifact"
      }
    },
    "evidence": {
      "type": "array",
      "maxItems": 512,
      "items": {
        "$ref": "#/$defs/evidence"
      }
    },
    "assumptions": {
      "$ref": "#/$defs/textSet"
    },
    "risks": {
      "$ref": "#/$defs/textSet"
    },
    "followUps": {
      "$ref": "#/$defs/textSet"
    }
  },
  "$defs": {
    "identifier": {
      "$ref": "https://github.com/GarrettAudet/SWECircuit/schemas/v1alpha1/common.schema.json#/$defs/identifier"
    },
    "digest": {
      "type": "string",
      "pattern": "^sha256:[0-9a-f]{64}$"
    },
    "text": {
      "type": "string",
      "minLength": 1,
      "maxLength": 16384
    },
    "mediaType": {
      "type": "string",
      "minLength": 3,
      "maxLength": 128,
      "pattern": "^[A-Za-z0-9!#$&^_.+-]+/[A-Za-z0-9!#$&^_.+-]+$"
    },
    "outcome": {
      "enum": ["pass", "fix", "diagnose", "clarify", "redesign", "split", "block", "learn"]
    },
    "textSet": {
      "type": "array",
      "maxItems": 256,
      "uniqueItems": true,
      "items": {
        "$ref": "#/$defs/text"
      }
    },
    "artifact": {
      "type": "object",
      "additionalProperties": false,
      "required": ["name", "mediaType", "content"],
      "properties": {
        "name": {
          "$ref": "#/$defs/text"
        },
        "mediaType": {
          "$ref": "#/$defs/mediaType"
        },
        "content": {
          "type": "string",
          "maxLength": 262144
        }
      }
    },
    "evidence": {
      "type": "object",
      "additionalProperties": false,
      "required": ["criterionId", "requirementId", "kind", "duty", "status", "artifact"],
      "properties": {
        "criterionId": {
          "$ref": "#/$defs/identifier"
        },
        "requirementId": {
          "$ref": "#/$defs/identifier"
        },
        "kind": {
          "enum": [
            "artifact",
            "command",
            "test",
            "review",
            "decision",
            "commit",
            "digest",
            "handoff",
            "memory"
          ]
        },
        "duty": {
          "enum": ["produce", "verify", "review"]
        },
        "status": {
          "$ref": "#/$defs/outcome"
        },
        "artifact": {
          "$ref": "#/$defs/text"
        }
      }
    }
  }
}
