{"apiVersion":"swecircuit/specialist/v1alpha1","kind":"SpecialistAgentHandoff","outcome":"fix","destination":"v11.integration-owner","goal":{"id":"v11.specialist-compiler.release","revision":30,"digest":"sha256:9743420992fef85e1ca82c26a259dde8f1524d7aed6506dbba43e702bb4479c1"},"agent":{"id":"agent.6dad2f7ca99d372fe3e35407a04133b48c9be6feccb4891ce0add91474a619a8","blueprintDigest":"sha256:41b2bb9ebd0273d17856c90a7f46220cfafa6aff4585f020aa403ca541f55347"},"compilationDigest":"sha256:ced8186898ebb27bac53e50e6b803c353766ae015464a2bae2b758cb6cf6cc36","summary":"FIX: preflight spawned executables outside the declared process authority; execution stopped before canonical release gates.","workUnitsCompleted":[],"artifacts":[{"name":"release-gate-evidence.md","mediaType":"text/markdown","content":"# Release Gate Evidence\n\n## Binding\n\n- Goal: `v11.specialist-compiler.release`, revision 30\n- Compilation: `sha256:ced8186898ebb27bac53e50e6b803c353766ae015464a2bae2b758cb6cf6cc36`\n- Package: `sha256:ddb642a474815b4ded464b40f5bd8225a404f610d3bd4a91d0ab2d43dc695f43`\n- Work unit: `verify.release-gates`\n\n## Outcome\n\n`FIX`. Preflight invoked `rg.exe` for scoped searches and `whoami.exe` for identity inspection. The contract permits process spawning only for `git`, `node`, `npm.cmd`, and `powershell`. These invocations escaped declared process authority, so execution stopped and no canonical gate was run.\n\n## Context Authentication\n\nAll 34 declared context files matched their exact raw SHA-256 digests and byte counts. The dependency handoff matched `sha256:3d855d14bffe913bb9c6bc93c97a202d0ea236af17826ebdcef0013cd4d04435` and 14494 bytes. The machine fan-in matched `sha256:a81dd130fff8edbe90542162b9582792b29343a38d9eec49d438675d2120801e` and 1388 bytes and reported `integrationReady: true`.\n\n## Preflight Evidence\n\n`TEMP`, `TMP`, and npm cache were bound before commands to the declared `.local/npm-cache` target. Windows exposed the short spelling `C:\\tmp\\SWECIR~2\\LOCAL~1\\NPM-CA~1`; its FileSystemObject short-path identity matched the authorized target. Two initial string-based alias probes exited 2 because `Resolve-Path` and FileSystemObject preserved the supplied spelling. A marker probe also exited 2 because the sandbox denied creation inside the otherwise declared cache authority; no marker file was created. No source or evidence document was modified.\n\n## Canonical Command Ledger\n\nNo canonical command was started after the authority escape. Exit status, test and case counts, package dry-run results, installed-consumer results, template-checker results, and canonical source-freshness results are therefore unavailable. Raw immutable-source binding freshness was established only for the 34 declared context files.\n"}],"evidence":[{"criterionId":"criterion.release","requirementId":"evidence.release-gates","kind":"test","duty":"verify","status":"fix","artifact":"release-gate-evidence.md"}],"assumptions":[],"risks":["Revision 30 release acceptance remains unverified because no canonical gate completed."],"followUps":["Rerun the exact Revision 30 release specialist from a fresh execution using only the declared process executables and a host that permits writes within the authorized `.local/npm-cache/**` and `dist/**` scopes."]}