{"apiVersion":"swecircuit/specialist/v1alpha1","kind":"SpecialistAgentHandoff","outcome":"pass","destination":"codex.main","goal":{"id":"v14.dogfood.release-board","revision":1,"digest":"sha256:17b787892abba5429003d87548bf40eb8715078f5636e55b46998d13cd959c0f"},"agent":{"id":"agent.712f06d08aac6fc693f821f2da168519dc1cd9a9634ebfa71a0982a90fef7228","blueprintDigest":"sha256:c7651a7bae7183610fe411cb06dfc24c0c0e91edbb6fe9da553bb55f08d3bf76"},"compilationDigest":"sha256:f4f4e91fc1fc8ea2b4cf52256395fa4e15b109cc5ebd4f8bc690c408c4b5eb7e","summary":"Implemented the complete responsive semantic Release Board interface with required controls, hooks, template, live region, and focus treatment.","workUnitsCompleted":["implement.release-board-interface"],"artifacts":[{"name":"release-board-interface-handoff.md","mediaType":"text/markdown","content":"Changed files: examples/release-board/index.html; examples/release-board/styles.css. Verification: confirmed required form, summary, filters, list, empty state, template, live region, module script, and data-action hooks; confirmed visible :focus-visible styling; confirmed no remote assets or inline event handlers."}],"evidence":[{"criterionId":"criterion.interface","requirementId":"evidence.interface.artifact","kind":"artifact","duty":"produce","status":"pass","artifact":"release-board-interface-handoff.md"}],"assumptions":[],"risks":[],"followUps":[]}