{"apiVersion":"swecircuit/specialist/v1alpha1","kind":"SpecialistAgentHandoff","outcome":"fix","destination":"codex.main","goal":{"id":"v11.1.readme-release-review","revision":1,"digest":"sha256:42a8b062d83c7b4da8a99c126156ca98726cb596756d0951289c59afdbcb56ed"},"agent":{"id":"agent.4a46f9924c1597feda7441bbb503b7c8445330fedf0bab277cd9784397d09437","blueprintDigest":"sha256:1173e7e8858d669c20b7d4a1a29dc30b85e9d60e7d95822232ced16ade755249"},"compilationDigest":"sha256:834690f6c366371e2bd450d121d27be4f82964d98ee84e39b6e82da70c3ad511","summary":"Fix: the verified GIF is clear at native size, but its fixed 1500px-wide composition makes essential explanatory labels illegible when proportionally reduced in a narrow README viewport.","workUnitsCompleted":["review.visual"],"artifacts":[{"name":"visual-clarity-review.json","mediaType":"application/json","content":"{\"verdict\":\"fix\",\"checks\":[{\"name\":\"boundSources\",\"status\":\"pass\",\"detail\":\"README.md, generator source, and GIF matched their declared SHA-256 digests and byte counts before review.\"},{\"name\":\"firstReadAndStates\",\"status\":\"pass\",\"detail\":\"Opening, parallel, and complete states establish goal, module sequence, routed UI/API/TEST specialists, and return to VERIFY without overlap.\"},{\"name\":\"routingAndFanIn\",\"status\":\"pass\",\"detail\":\"The ROUTE branch, parallel agents, colored return packets, VERIFY handoff check, MERGE, TRACE, and MEMORY form a coherent end-to-end path.\"},{\"name\":\"hostBoundaryAndRail\",\"status\":\"pass\",\"detail\":\"The GIF and adjacent README distinguish core contract compilation and verification from the external IDE or host that runs specialists and integrates work.\"},{\"name\":\"reducedWidthLegibility\",\"status\":\"fix\",\"detail\":\"At proportional half-width display, 14px phase labels become about 7px and 15px explanatory labels become about 7.5px; the host-run-parallel caption, module details, and verify/trace meaning are no longer reliably readable.\"}],\"findings\":[{\"id\":\"visual.reduced-width-text\",\"severity\":\"release\",\"scope\":\"README GIF responsive legibility\",\"evidence\":\"The fixed 1500x560 frame relies on 14-16px phase and trace text plus 15px detail text. A typical constrained README image scales those labels below readable size before the flow can be understood.\",\"impact\":\"Narrow-viewport readers can see the broad diagram but lose the explanatory language that establishes modular-rail meaning, external-host responsibility, and verified fan-in.\",\"recommendation\":\"Provide a narrow-layout companion visual or redesign the GIF with materially larger essential labels and fewer simultaneous text elements so its key explanatory copy remains legible at constrained display widths.\"}]}"}],"evidence":[{"criterionId":"criterion.visual-clarity","requirementId":"evidence.visual-review","kind":"review","duty":"produce","status":"fix","artifact":"visual-clarity-review.json"}],"assumptions":["Reduced-width assessment uses proportional rendering of the verified 1500x560 GIF in a constrained README viewport."],"risks":["The release surface remains difficult to comprehend on narrow displays until the reduced-width finding is addressed."],"followUps":["Recheck opening, parallel, and final states at narrow README widths after the responsive visual treatment is revised."]}